{
  "$schema": "http://json-schema.org/draft-07/schema#",
  "$id": "https://github.com/37chengshan/eduevidence/schemas/report-spec.schema.json",
  "title": "ReportSpec",
  "description": "Build record emitted next to every rendered report by visualization/eduevidence-report/scripts/build_report.py. It records which theme was baked, which charts the gallery selected or suppressed (with reasons), the integrity-gate result, and the chapter outline. It is a projection record, never a research fact store. Legacy packs that predate this contract carry a smaller shape (mode/title/theme/sections) which is accepted for compatibility.",
  "type": "object",
  "additionalProperties": false,
  "required": [],
  "properties": {
    "generated_by": {
      "type": "string"
    },
    "source": {
      "type": "string"
    },
    "question": {
      "type": "string"
    },
    "theme_selected": {
      "type": "string"
    },
    "theme_display": {
      "type": "string"
    },
    "theme_available": {
      "type": "array",
      "items": {
        "type": "string"
      }
    },
    "theme_selection": {
      "type": "string"
    },
    "lang_default": {
      "type": "string"
    },
    "lang_switchable": {
      "type": "array",
      "items": {
        "type": "string"
      }
    },
    "report_pages": {
      "type": "array",
      "items": {
        "type": "string"
      }
    },
    "full_report_outline": {
      "type": "object",
      "additionalProperties": true,
      "description": "Chapter plan actually rendered, plus the source it was resolved from (result.report_outline, or safe_fallback)."
    },
    "visualization_decisions": {
      "type": "object",
      "additionalProperties": true
    },
    "lieflat_gallery": {
      "type": "object",
      "additionalProperties": true,
      "description": "Selected / suppressed / rejected gallery entries with reasons, and the layout_source (visual_layout or deterministic_fallback)."
    },
    "charts": {
      "type": "array",
      "items": {
        "$ref": "chart-spec.schema.json"
      },
      "description": "Chart records; each one must satisfy schemas/chart-spec.schema.json."
    },
    "infographics": {
      "type": "array",
      "items": {
        "type": "object",
        "additionalProperties": true
      }
    },
    "academic_figures": {
      "type": "array",
      "items": {
        "type": "object",
        "additionalProperties": true
      }
    },
    "integrity_gate": {
      "type": "object",
      "additionalProperties": true
    },
    "mode": {
      "type": "string"
    },
    "title": {
      "type": "string"
    },
    "theme": {
      "type": "string"
    },
    "sections": {
      "type": "array"
    },
    "generated_at": {
      "type": "string"
    },
    "integrity": {
      "type": "object",
      "additionalProperties": true
    },
    "extensions": {
      "type": "object",
      "additionalProperties": true
    }
  },
  "anyOf": [
    {
      "required": [
        "theme_selected",
        "integrity_gate"
      ]
    },
    {
      "required": [
        "mode",
        "title",
        "theme",
        "sections"
      ]
    }
  ]
}
