{
  "generated_by": "build_report.py",
  "source": "result.json + result.zh.json",
  "question": "We are considering allowing students to use generative AI coding assistants in the first-year C programming course. Will it actually improve learning outcomes? How should it be introduced?",
  "theme_selected": "academic",
  "theme_display": "Academic Paper [Light]",
  "theme_available": [
    "claude",
    "academic",
    "datalab",
    "datalab-dark",
    "presentation"
  ],
  "theme_selection": "generation_time",
  "lang_default": "zh",
  "lang_switchable": [
    "zh",
    "en"
  ],
  "report_pages": [
    "visual_brief",
    "full_report"
  ],
  "full_report_outline": {
    "chapter_count": 6,
    "source": "result.report_outline",
    "chapters": [
      {
        "key": "decision",
        "title_zh": "执行决策与问题边界",
        "title_en": "Decision & Question Scope",
        "modules": [
          "decision",
          "scope"
        ]
      },
      {
        "key": "retrieval",
        "title_zh": "检索策略与证据选择",
        "title_en": "Retrieval & Evidence Selection",
        "modules": [
          "retrieval",
          "evidence"
        ]
      },
      {
        "key": "outcomes",
        "title_zh": "结果证据地图",
        "title_en": "Outcome Evidence Map",
        "modules": [
          "outcomes"
        ]
      },
      {
        "key": "quality",
        "title_zh": "质量审计与冲突分析",
        "title_en": "Quality Audit & Conflicts",
        "modules": [
          "quality",
          "conflicts",
          "trace"
        ]
      },
      {
        "key": "action",
        "title_zh": "适用性与教学干预",
        "title_en": "Applicability & Intervention",
        "modules": [
          "applicability",
          "intervention"
        ]
      },
      {
        "key": "evaluation",
        "title_zh": "评价方案与来源",
        "title_en": "Evaluation & Sources",
        "modules": [
          "evaluation",
          "sources"
        ]
      }
    ]
  },
  "visualization_decisions": {
    "outcome_separation": {
      "render": true,
      "reason": "multiple outcome constructs present"
    },
    "outcome_evidence_balance": {
      "render": true,
      "reason": "sufficient effect-direction density"
    },
    "claim_trace": {
      "render": true,
      "reason": "claim-evidence-source relationships present"
    },
    "benchmark": {
      "render": false,
      "reason": "suppressed: absent, simulated, or fewer than two baselines"
    }
  },
  "lieflat_gallery": {
    "layout_source": "deterministic_fallback",
    "selected": [
      {
        "chart_id": "lieflat-tick-rows.svg",
        "type": "tick_rows",
        "catalog_ref": "F5 Tick Rows",
        "source": "outcomes.direction_counts"
      }
    ],
    "suppressed": [
      {
        "chart_id": "lieflat-forest-plot.svg",
        "type": "forest_plot",
        "catalog_ref": "FOREST-PLOT (publication figure)",
        "reason": "fewer than 3 studies with numeric effect size (got 0)"
      },
      {
        "chart_id": "lieflat-dot-cascade.svg",
        "type": "dot_cascade",
        "catalog_ref": "L2 Dot Cascade",
        "reason": "fewer than 3 studies with numeric effect size (got 0)"
      },
      {
        "chart_id": "lieflat-bubble-almanac.svg",
        "type": "bubble_almanac",
        "catalog_ref": "L9 Bubble Almanac",
        "reason": "fewer than 2 distinct publication years (got 0)"
      }
    ],
    "rejected": [],
    "warnings": [
      "visual_layout missing or fully invalid — using deterministic safe combination (forest_plot + dot_cascade + bubble_almanac + tick_rows)"
    ]
  },
  "charts": [
    {
      "chart_id": "outcome-evidence-overview",
      "purpose": "interactive_analysis",
      "engine": "echarts",
      "data_ref": null,
      "title": "Outcome Evidence Overview",
      "integrity": {
        "numbers_match_result": "NOT_CHECKED",
        "no_axis_distortion": "NOT_CHECKED",
        "no_false_precision": "NOT_CHECKED",
        "colorblind_safe": "NOT_CHECKED"
      }
    },
    {
      "chart_id": "claim-evidence-trace",
      "purpose": "interactive_analysis",
      "engine": "echarts",
      "data_ref": null,
      "title": "Claim-Evidence Trace",
      "integrity": {
        "numbers_match_result": "NOT_CHECKED",
        "no_axis_distortion": "NOT_CHECKED",
        "no_false_precision": "NOT_CHECKED",
        "colorblind_safe": "NOT_CHECKED"
      }
    }
  ],
  "infographics": [
    {
      "chart_id": "workflow",
      "purpose": "process_or_story",
      "engine": "antv_infographic",
      "title": ""
    },
    {
      "chart_id": "tribunal",
      "purpose": "process_or_story",
      "engine": "antv_infographic",
      "title": ""
    },
    {
      "chart_id": "intervention",
      "purpose": "process_or_story",
      "engine": "antv_infographic",
      "title": ""
    },
    {
      "chart_id": "evaluation",
      "purpose": "process_or_story",
      "engine": "antv_infographic",
      "title": ""
    }
  ],
  "academic_figures": [
    {
      "chart_id": "outcome-comparison",
      "purpose": "statistical_publication",
      "engine": "academic_figure",
      "caption": "Fig. 1. Counts of positive / negative / null effects per outcome type (based on effect_direction; publication figure, theme-independent). Source: EduEvidence result.json."
    }
  ],
  "integrity_gate": {
    "status": "PASS",
    "contract_valid": "PASS",
    "claims_bound": "PASS",
    "evidence_bound": 13,
    "sources_resolved": 7,
    "numbers_match_result": "PASS",
    "bilingual_structure_match": "PASS",
    "language_match": "PASS",
    "no_false_precision": "PASS",
    "lieflat_data_bound": "PASS",
    "no_axis_distortion": "NOT_CHECKED",
    "colorblind_safe": "NOT_CHECKED",
    "langs": [
      "zh",
      "en"
    ],
    "generated_by": "build_report.py",
    "source": "result.json + result.zh.json"
  }
}